{
  "schema_version": "1.0.0",
  "evaluation_id": "evaluation.r4.fixed-v1",
  "title": "R-4 direct, metadata, relation, scope, and Korean retrieval acceptance set",
  "source_design": {
    "path": "docs/reports/2026-07-20_R-1.1_지식_시스템_설계_보정.md",
    "locators": ["§10.4 R-4", "§12.2 R-2B 이후", "§13 공통 완료·안전 기준"],
    "approval": "User authorized R-4 execution on 2026-07-21; strict metrics preserve the accepted no-irrelevant-context and no-leakage gates."
  },
  "thresholds": {
    "minimum_recall_at_k": 1.0,
    "minimum_precision_at_k": 1.0,
    "minimum_source_trace_rate": 1.0,
    "maximum_protected_leakage": 0
  },
  "queries": [
    {
      "query_id": "r4.rule.direct-routing",
      "category": "rule_decision",
      "mode": "exact",
      "query": "rule.retrieval.direct-routing-first",
      "exact_ids": ["rule.retrieval.direct-routing-first"],
      "expand_relations": false,
      "k": 1,
      "budget_bytes": 1800,
      "expected_ids": ["rule.retrieval.direct-routing-first"]
    },
    {
      "query_id": "r4.decision.d14-evidence",
      "category": "rule_decision",
      "mode": "exact",
      "query": "D-14의 공유 work context 근거",
      "exact_ids": ["decision.r1.1.d14"],
      "expand_relations": true,
      "k": 2,
      "budget_bytes": 5000,
      "expected_ids": ["decision.r1.1.d14", "knowledge.context.shared-work-context"]
    },
    {
      "query_id": "r4.korean.protected-prefilter",
      "category": "korean_descriptive",
      "mode": "text",
      "query": "보호 경로 사전 차단",
      "seed_limit": 1,
      "expand_relations": false,
      "k": 1,
      "budget_bytes": 2600,
      "expected_ids": ["knowledge.safety.protected-prefilter"]
    },
    {
      "query_id": "r4.korean.document-duplication-case",
      "category": "korean_descriptive",
      "mode": "text",
      "query": "중복 문서 권위 충돌 반복 생성",
      "seed_limit": 1,
      "expand_relations": true,
      "k": 2,
      "budget_bytes": 8000,
      "expected_ids": ["case.project.document-authority-duplication", "knowledge.governance.single-owner"]
    },
    {
      "query_id": "r4.metadata.context-implementation",
      "category": "metadata_scope",
      "mode": "metadata",
      "query": "context 구현과 회귀 테스트",
      "filters": {
        "kinds": ["code", "test"],
        "statuses": ["active"],
        "task_tags": ["context"],
        "path_prefixes": ["tools/context", "tests/context"]
      },
      "expand_relations": false,
      "k": 2,
      "budget_bytes": 3000,
      "expected_ids": ["file.tools.context.context-system", "file.tests.context.test-context-system"]
    },
    {
      "query_id": "r4.stale.historical-source-excluded",
      "category": "stale_candidate",
      "mode": "exact",
      "query": "historical overview source",
      "exact_ids": ["source.history.overview"],
      "expand_relations": false,
      "k": 1,
      "budget_bytes": 512,
      "expected_ids": [],
      "required_exclusion_ids": ["source.history.overview"]
    },
    {
      "query_id": "r4.conflict.current-default",
      "category": "conflict",
      "mode": "conflict_scan",
      "query": "현재 기본 검색에 노출되는 상충 지식",
      "expand_relations": false,
      "k": 1,
      "budget_bytes": 512,
      "expected_ids": []
    },
    {
      "query_id": "r4.scope.protected-rejected",
      "category": "protected_scope",
      "mode": "exact",
      "query": "보호 task 파일 검색",
      "scope_paths": ["inputs/r4-forbidden"],
      "exact_ids": [],
      "expand_relations": false,
      "k": 1,
      "budget_bytes": 512,
      "expected_ids": [],
      "expected_outcome": "rejected",
      "required_exclusion_ids": ["inputs/r4-forbidden"]
    }
  ]
}
